{
  "schema_version": "asw.agent_access.v1",
  "grant_id": "grant_codex",
  "agent_subscriber_id": "agent:codex-1",
  "enabled": true,
  "applications": [
    "app.visual-studio"
  ],
  "categories": [
    "files",
    "jobs",
    "diagnostics",
    "artifacts"
  ],
  "allow_replay": true,
  "created_at": "2026-08-01T12:06:00-04:00",
  "expires_at": null
}
